{
  "type": "autodocs_report",
  "generated_at": "2026-03-07T09:36:23Z",
  "skills_seen": [
    "__init__",
    "_event_logger",
    "_report_publish",
    "autodocs_generate",
    "bandit_router_select",
    "budget_analyze",
    "budget_router",
    "capability_map_build",
    "cleanup_apply",
    "cleanup_plan_apply",
    "clockwork_version_bump",
    "code_assimilate",
    "code_clean",
    "code_clean_scan",
    "contract_drift_sentinel",
    "copyright_standardize",
    "create_mvp",
    "creativity_burst",
    "critics_board_review",
    "decision_feedback",
    "deliberation_pack_build",
    "determinism_harness",
    "determinism_proof",
    "doc_review",
    "doc_ssot_resolver",
    "doc_write",
    "drift_semantic_check",
    "economics_regression",
    "edge_case_selector",
    "efficiency_review",
    "escalation_router",
    "eval_run",
    "evidence_bundle_build",
    "evidence_init",
    "evidence_router",
    "exec_dryrun",
    "hardening_scan_fix",
    "hello",
    "hypothesis_builder",
    "idea_dedupe",
    "idea_scoring",
    "last_train",
    "last_train_merge",
    "limitation_harvest_scan",
    "log_standardize",
    "mechanic_explain",
    "model_routing_record_outcome",
    "model_routing_select",
    "mutation_detect",
    "outcome_event_generate",
    "outcome_ledger_append",
    "parity_scan_and_mvp_planner",
    "pattern_detect",
    "pdf_export",
    "pdf_quality",
    "pdf_render",
    "performance_finalize",
    "performance_toggle",
    "plan_diff_apply",
    "plan_lint",
    "plan_mutate",
    "policy_gatekeeper",
    "prompt_debt_capture",
    "qa_gate",
    "refactor_bridge_scan",
    "reference_fix",
    "release_cut",
    "repo_clean",
    "repo_clean_scan",
    "repo_compare",
    "repo_validate",
    "report",
    "review_panel",
    "route_autotune_suggest",
    "route_profile_patch_pack",
    "route_profile_update",
    "scan",
    "schema_batch_validate",
    "screencast_script",
    "security_redactor",
    "shadow_prompt",
    "shadow_prompt_minify",
    "skill_gap_detect",
    "skill_registry_search",
    "skill_scaffold",
    "spec_validate",
    "system_map",
    "team_topology_verify",
    "telemetry_summarize",
    "token_event_log",
    "triad_build",
    "triad_ref_lint",
    "tutorial_write",
    "work_scope_assess"
  ],
  "written": [],
  "updated": [],
  "warnings": [],
  "limitations": [
    "This is deterministic scaffolding; it does not deeply understand semantics of code.",
    "It will not overwrite existing docs unless mode allows it.",
    "Registry parsing is heuristic (expects '### N) skill_id')."
  ]
}